### ISSUE TITLE
Management plugin floods log with errors

### ISSUE THREAD

**Issue by jangrewe** [rabbitmq/rabbitmq-management#570]
We have a 3 node cluster running Docker images with the tag `3.7.4-management`, and those nodes are slowly but surely filling disks by logging errors caused by the the management plugin:

```
2018-04-30 14:18:07.061 [info] <0.33.0> Application lager started on node 'rabbit@clu-1-b'
2018-04-30 14:18:08.442 [info] <0.33.0> Application mnesia started on node 'rabbit@clu-1-b'
2018-04-30 14:18:08.444 [info] <0.33.0> Application mnesia exited with reason: stopped
2018-04-30 14:18:08.636 [info] <0.33.0> Application mnesia started on node 'rabbit@clu-1-b'
2018-04-30 14:18:08.636 [info] <0.33.0> Application recon started on node 'rabbit@clu-1-b'
2018-04-30 14:18:08.636 [info] <0.33.0> Application jsx started on node 'rabbit@clu-1-b'
2018-04-30 14:18:08.636 [info] <0.33.0> Application os_mon started on node 'rabbit@clu-1-b'
2018-04-30 14:18:08.636 [info] <0.33.0> Application xmerl started on node 'rabbit@clu-1-b'
2018-04-30 14:18:08.637 [info] <0.33.0> Application inets started on node 'rabbit@clu-1-b'
2018-04-30 14:18:08.637 [info] <0.33.0> Application asn1 started on node 'rabbit@clu-1-b'
2018-04-30 14:18:08.637 [info] <0.33.0> Application crypto started on node 'rabbit@clu-1-b'
2018-04-30 14:18:08.637 [info] <0.33.0> Application public_key started on node 'rabbit@clu-1-b'
2018-04-30 14:18:08.637 [info] <0.33.0> Application cowlib started on node 'rabbit@clu-1-b'
2018-04-30 14:18:08.637 [info] <0.33.0> Application ssl started on node 'rabbit@clu-1-b'
2018-04-30 14:18:08.637 [info] <0.33.0> Application ranch started on node 'rabbit@clu-1-b'
2018-04-30 14:18:08.641 [info] <0.33.0> Application cowboy started on node 'rabbit@clu-1-b'
2018-04-30 14:18:08.641 [info] <0.33.0> Application ranch_proxy_protocol started on node 'rabbit@clu-1-b'
2018-04-30 14:18:08.641 [info] <0.33.0> Application rabbit_common started on node 'rabbit@clu-1-b'
2018-04-30 14:18:08.643 [info] <0.33.0> Application amqp_client started on node 'rabbit@clu-1-b'
2018-04-30 14:18:08.643 [info] <0.251.0> 
 Starting RabbitMQ 3.7.4 on Erlang 20.2.4
 Copyright (C) 2007-2018 Pivotal Software, Inc.
 Licensed under the MPL.  See http://www.rabbitmq.com/

  ##  ##
  ##  ##      RabbitMQ 3.7.4. Copyright (C) 2007-2018 Pivotal Software, Inc.
  ##########  Licensed under the MPL.  See http://www.rabbitmq.com/
  ######  ##
  ##########  Logs: <stdout>

              Starting broker...
2018-04-30 14:18:08.644 [info] <0.251.0> 
 node           : rabbit@clu-1-b
 home dir       : /var/lib/rabbitmq
 config file(s) : /etc/rabbitmq/rabbitmq.conf
 cookie hash    : 0xnope...
 log(s)         : <stdout>
 database dir   : /var/lib/rabbitmq/mnesia/rabbit@clu-1-b
2018-04-30 14:18:08.855 [info] <0.331.0> Memory high watermark set to 51532 MiB (54036024524 bytes) of 128831 MiB (135090061312 bytes) total
2018-04-30 14:18:08.859 [info] <0.333.0> Enabling free disk space monitoring
2018-04-30 14:18:08.859 [info] <0.333.0> Disk free limit set to 50MB
2018-04-30 14:18:08.863 [info] <0.336.0> FHC read buffering:  OFF
2018-04-30 14:18:08.863 [info] <0.336.0> FHC write buffering: ON
2018-04-30 14:18:08.863 [info] <0.335.0> Limiting to approx 1048476 file handles (943626 sockets)
2018-04-30 14:18:08.866 [info] <0.251.0> Waiting for Mnesia tables for 30000 ms, 9 retries left
2018-04-30 14:18:08.867 [info] <0.251.0> Waiting for Mnesia tables for 30000 ms, 9 retries left
2018-04-30 14:18:08.911 [info] <0.251.0> Waiting for Mnesia tables for 30000 ms, 9 retries left
2018-04-30 14:18:08.911 [info] <0.251.0> Peer discovery backend rabbit_peer_discovery_classic_config does not support registration, skipping registration.
2018-04-30 14:18:08.912 [info] <0.251.0> Priority queues enabled, real BQ is rabbit_variable_queue
2018-04-30 14:18:08.917 [info] <0.389.0> Starting rabbit_node_monitor
2018-04-30 14:18:08.939 [info] <0.251.0> Management plugin: using rates mode 'basic'
2018-04-30 14:18:08.939 [info] <0.415.0> Making sure data directory '/var/lib/rabbitmq/mnesia/rabbit@clu-1-b/msg_stores/vhosts/628WB79CIFDYO9LJI6DKMI09L' for vhost '/' exists
2018-04-30 14:18:08.941 [info] <0.415.0> Starting message stores for vhost '/'
2018-04-30 14:18:08.941 [info] <0.419.0> Message store "628WB79CIFDYO9LJI6DKMI09L/msg_store_transient": using rabbit_msg_store_ets_index to provide index
2018-04-30 14:18:08.943 [info] <0.415.0> Started message store of type transient for vhost '/'
2018-04-30 14:18:08.943 [info] <0.422.0> Message store "628WB79CIFDYO9LJI6DKMI09L/msg_store_persistent": using rabbit_msg_store_ets_index to provide index
2018-04-30 14:18:08.945 [info] <0.415.0> Started message store of type persistent for vhost '/'
2018-04-30 14:18:08.996 [info] <0.535.0> Making sure data directory '/var/lib/rabbitmq/mnesia/rabbit@clu-1-b/msg_stores/vhosts/CPZYVZ8FXM414K16J269JBK6V' for vhost 'prod' exists
2018-04-30 14:18:08.998 [info] <0.535.0> Starting message stores for vhost 'prod'
2018-04-30 14:18:08.998 [info] <0.539.0> Message store "CPZYVZ8FXM414K16J269JBK6V/msg_store_transient": using rabbit_msg_store_ets_index to provide index
2018-04-30 14:18:09.000 [info] <0.535.0> Started message store of type transient for vhost 'prod'
2018-04-30 14:18:09.000 [info] <0.542.0> Message store "CPZYVZ8FXM414K16J269JBK6V/msg_store_persistent": using rabbit_msg_store_ets_index to provide index
2018-04-30 14:18:09.001 [info] <0.535.0> Started message store of type persistent for vhost 'prod'
2018-04-30 14:18:09.070 [info] <0.703.0> started TCP Listener on [::]:5672
2018-04-30 14:18:09.072 [info] <0.251.0> Setting up a table for connection tracking on this node: 'tracked_connection_on_node_rabbit@clu-1-b'
2018-04-30 14:18:09.073 [info] <0.251.0> Setting up a table for per-vhost connection counting on this node: 'tracked_connection_per_vhost_on_node_rabbit@clu-1-b'
2018-04-30 14:18:09.074 [info] <0.389.0> rabbit on node 'rabbit@clu-2-b' up
2018-04-30 14:18:09.074 [info] <0.33.0> Application rabbit started on node 'rabbit@clu-1-b'
2018-04-30 14:18:09.097 [info] <0.389.0> rabbit on node 'rabbit@clu-3-b' up
2018-04-30 14:18:09.108 [info] <0.33.0> Application rabbitmq_management_agent started on node 'rabbit@clu-1-b'
2018-04-30 14:18:09.108 [info] <0.33.0> Application rabbitmq_web_dispatch started on node 'rabbit@clu-1-b'
2018-04-30 14:18:09.153 [info] <0.756.0> Management plugin started. Port: 15672
2018-04-30 14:18:09.153 [info] <0.862.0> Statistics database started.
2018-04-30 14:18:09.154 [info] <0.33.0> Application rabbitmq_management started on node 'rabbit@clu-1-b'
 completed with 3 plugins.
2018-04-30 14:18:09.318 [info] <0.5.0> Server startup complete; 3 plugins started.
 * rabbitmq_management
 * rabbitmq_web_dispatch
 * rabbitmq_management_agent
2018-04-30 14:18:09.762 [error] <0.883.0> CRASH REPORT Process <0.883.0> with 0 neighbours crashed with reason: bad argument in call to erlang:port_get_data(#Port<0.25771>) in prim_file:sendfile/8
2018-04-30 14:18:09.762 [error] <0.758.0> Ranch listener rabbit_web_dispatch_sup_15672 had connection process started with cowboy_clear:start_link/4 at <0.883.0> exit with reason: {badarg,[{erlang,port_get_data,[#Port<0.25771>],[]},{prim_file,sendfile,8,[]},{file,sendfile,8,[{file,"file.erl"},{line,1287}]},{ranch_tcp,sendfile,5,[{file,"src/ranch_tcp.erl"},{line,161}]},{ranch_tcp,sendfile,5,[{file,"src/ranch_tcp.erl"},{line,148}]},{cowboy_http,commands,3,[{file,"src/cowboy_http.erl"},{line,982}]},{cowboy_http,loop,2,[{file,"src/cowboy_http.erl"},{line,200}]},{proc_lib,init_p_do_apply,3,[{file,"proc_lib.erl"},{line,247}]}]}
2018-04-30 14:18:11.745 [error] <0.890.0> CRASH REPORT Process <0.890.0> with 0 neighbours crashed with reason: bad argument in call to erlang:port_get_data(#Port<0.25779>) in prim_file:sendfile/8
2018-04-30 14:18:11.745 [error] <0.758.0> Ranch listener rabbit_web_dispatch_sup_15672 had connection process started with cowboy_clear:start_link/4 at <0.890.0> exit with reason: {badarg,[{erlang,port_get_data,[#Port<0.25779>],[]},{prim_file,sendfile,8,[]},{file,sendfile,8,[{file,"file.erl"},{line,1287}]},{ranch_tcp,sendfile,5,[{file,"src/ranch_tcp.erl"},{line,161}]},{ranch_tcp,sendfile,5,[{file,"src/ranch_tcp.erl"},{line,148}]},{cowboy_http,commands,3,[{file,"src/cowboy_http.erl"},{line,982}]},{cowboy_http,loop,2,[{file,"src/cowboy_http.erl"},{line,200}]},{proc_lib,init_p_do_apply,3,[{file,"proc_lib.erl"},{line,247}]}]}
2018-04-30 14:18:11.757 [error] <0.898.0> CRASH REPORT Process <0.898.0> with 0 neighbours crashed with reason: bad argument in call to erlang:port_get_data(#Port<0.25787>) in prim_file:sendfile/8
2018-04-30 14:18:11.758 [error] <0.758.0> Ranch listener rabbit_web_dispatch_sup_15672 had connection process started with cowboy_clear:start_link/4 at <0.898.0> exit with reason: {badarg,[{erlang,port_get_data,[#Port<0.25787>],[]},{prim_file,sendfile,8,[]},{file,sendfile,8,[{file,"file.erl"},{line,1287}]},{ranch_tcp,sendfile,5,[{file,"src/ranch_tcp.erl"},{line,161}]},{ranch_tcp,sendfile,5,[{file,"src/ranch_tcp.erl"},{line,148}]},{cowboy_http,commands,3,[{file,"src/cowboy_http.erl"},{line,982}]},{cowboy_http,loop,2,[{file,"src/cowboy_http.erl"},{line,200}]},{proc_lib,init_p_do_apply,3,[{file,"proc_lib.erl"},{line,247}]}]}
2018-04-30 14:18:11.770 [error] <0.904.0> CRASH REPORT Process <0.904.0> with 0 neighbours crashed with reason: no match of right hand value {error,einval} in prim_file:sendfile/8
2018-04-30 14:18:11.771 [error] <0.758.0> Ranch listener rabbit_web_dispatch_sup_15672 had connection process started with cowboy_clear:start_link/4 at <0.904.0> exit with reason: {{badmatch,{error,einval}},[{prim_file,sendfile,8,[]},{file,sendfile,8,[{file,"file.erl"},{line,1287}]},{ranch_tcp,sendfile,5,[{file,"src/ranch_tcp.erl"},{line,161}]},{ranch_tcp,sendfile,5,[{file,"src/ranch_tcp.erl"},{line,148}]},{cowboy_http,commands,3,[{file,"src/cowboy_http.erl"},{line,982}]},{cowboy_http,loop,2,[{file,"src/cowboy_http.erl"},{line,200}]},{proc_lib,init_p_do_apply,3,[{file,"proc_lib.erl"},{line,247}]}]}
2018-04-30 14:18:13.748 [error] <0.910.0> CRASH REPORT Process <0.910.0> with 0 neighbours crashed with reason: bad argument in call to erlang:port_get_data(#Port<0.25801>) in prim_file:sendfile/8
2018-04-30 14:18:13.749 [error] <0.758.0> Ranch listener rabbit_web_dispatch_sup_15672 had connection process started with cowboy_clear:start_link/4 at <0.910.0> exit with reason: {badarg,[{erlang,port_get_data,[#Port<0.25801>],[]},{prim_file,sendfile,8,[]},{file,sendfile,8,[{file,"file.erl"},{line,1287}]},{ranch_tcp,sendfile,5,[{file,"src/ranch_tcp.erl"},{line,161}]},{ranch_tcp,sendfile,5,[{file,"src/ranch_tcp.erl"},{line,148}]},{cowboy_http,commands,3,[{file,"src/cowboy_http.erl"},{line,982}]},{cowboy_http,loop,2,[{file,"src/cowboy_http.erl"},{line,200}]},{proc_lib,init_p_do_apply,3,[{file,"proc_lib.erl"},{line,247}]}]}
2018-04-30 14:18:13.754 [error] <0.914.0> CRASH REPORT Process <0.914.0> with 0 neighbours crashed with reason: no match of right hand value {error,einval} in prim_file:sendfile/8
2018-04-30 14:18:13.754 [error] <0.758.0> Ranch listener rabbit_web_dispatch_sup_15672 had connection process started with cowboy_clear:start_link/4 at <0.914.0> exit with reason: {{badmatch,{error,einval}},[{prim_file,sendfile,8,[]},{file,sendfile,8,[{file,"file.erl"},{line,1287}]},{ranch_tcp,sendfile,5,[{file,"src/ranch_tcp.erl"},{line,161}]},{ranch_tcp,sendfile,5,[{file,"src/ranch_tcp.erl"},{line,148}]},{cowboy_http,commands,3,[{file,"src/cowboy_http.erl"},{line,982}]},{cowboy_http,loop,2,[{file,"src/cowboy_http.erl"},{line,200}]},{proc_lib,init_p_do_apply,3,[{file,"proc_lib.erl"},{line,247}]}]}
2018-04-30 14:18:13.759 [error] <0.916.0> CRASH REPORT Process <0.916.0> with 0 neighbours crashed with reason: no match of right hand value {error,einval} in prim_file:sendfile/8
2018-04-30 14:18:13.760 [error] <0.758.0> Ranch listener rabbit_web_dispatch_sup_15672 had connection process started with cowboy_clear:start_link/4 at <0.916.0> exit with reason: {{badmatch,{error,einval}},[{prim_file,sendfile,8,[]},{file,sendfile,8,[{file,"file.erl"},{line,1287}]},{ranch_tcp,sendfile,5,[{file,"src/ranch_tcp.erl"},{line,161}]},{ranch_tcp,sendfile,5,[{file,"src/ranch_tcp.erl"},{line,148}]},{cowboy_http,commands,3,[{file,"src/cowboy_http.erl"},{line,982}]},{cowboy_http,loop,2,[{file,"src/cowboy_http.erl"},{line,200}]},{proc_lib,init_p_do_apply,3,[{file,"proc_lib.erl"},{line,247}]}]}
2018-04-30 14:18:13.764 [error] <0.920.0> CRASH REPORT Process <0.920.0> with 0 neighbours crashed with reason: no match of right hand value {error,einval} in prim_file:sendfile/8
2018-04-30 14:18:13.764 [error] <0.758.0> Ranch listener rabbit_web_dispatch_sup_15672 had connection process started with cowboy_clear:start_link/4 at <0.920.0> exit with reason: {{badmatch,{error,einval}},[{prim_file,sendfile,8,[]},{file,sendfile,8,[{file,"file.erl"},{line,1287}]},{ranch_tcp,sendfile,5,[{file,"src/ranch_tcp.erl"},{line,161}]},{ranch_tcp,sendfile,5,[{file,"src/ranch_tcp.erl"},{line,148}]},{cowboy_http,commands,3,[{file,"src/cowboy_http.erl"},{line,982}]},{cowboy_http,loop,2,[{file,"src/cowboy_http.erl"},{line,200}]},{proc_lib,init_p_do_apply,3,[{file,"proc_lib.erl"},{line,247}]}]}
2018-04-30 14:18:13.771 [error] <0.922.0> CRASH REPORT Process <0.922.0> with 0 neighbours crashed with reason: no match of right hand value {error,einval} in prim_file:sendfile/8
2018-04-30 14:18:13.772 [error] <0.758.0> Ranch listener rabbit_web_dispatch_sup_15672 had connection process started with cowboy_clear:start_link/4 at <0.922.0> exit with reason: {{badmatch,{error,einval}},[{prim_file,sendfile,8,[]},{file,sendfile,8,[{file,"file.erl"},{line,1287}]},{ranch_tcp,sendfile,5,[{file,"src/ranch_tcp.erl"},{line,161}]},{ranch_tcp,sendfile,5,[{file,"src/ranch_tcp.erl"},{line,148}]},{cowboy_http,commands,3,[{file,"src/cowboy_http.erl"},{line,982}]},{cowboy_http,loop,2,[{file,"src/cowboy_http.erl"},{line,200}]},{proc_lib,init_p_do_apply,3,[{file,"proc_lib.erl"},{line,247}]}]}
2018-04-30 14:18:15.743 [error] <0.924.0> CRASH REPORT Process <0.924.0> with 0 neighbours crashed with reason: bad argument in call to erlang:port_get_data(#Port<0.25818>) in prim_file:sendfile/8
2018-04-30 14:18:15.743 [error] <0.758.0> Ranch listener rabbit_web_dispatch_sup_15672 had connection process started with cowboy_clear:start_link/4 at <0.924.0> exit with reason: {badarg,[{erlang,port_get_data,[#Port<0.25818>],[]},{prim_file,sendfile,8,[]},{file,sendfile,8,[{file,"file.erl"},{line,1287}]},{ranch_tcp,sendfile,5,[{file,"src/ranch_tcp.erl"},{line,161}]},{ranch_tcp,sendfile,5,[{file,"src/ranch_tcp.erl"},{line,148}]},{cowboy_http,commands,3,[{file,"src/cowboy_http.erl"},{line,982}]},{cowboy_http,loop,2,[{file,"src/cowboy_http.erl"},{line,200}]},{proc_lib,init_p_do_apply,3,[{file,"proc_lib.erl"},{line,247}]}]}
[...]
```

The management interface seems to work fine nonetheless, but the amount of errors just makes it a pain to have enabled.

Using the tag `3.7.4` stops these errors.

**Comment by jangrewe** [comment]
Docker inspect output:
```
[
    {
        "Id": "004de4cb27f124002c6142c1412603d319f3a1f71af7605b0c9ca168d7d4b3d3",
        "Created": "2018-04-30T14:30:31.519603738Z",
        "Path": "docker-entrypoint.sh",
        "Args": [
            "rabbitmq-server"
        ],
        "State": {
            "Status": "running",
            "Running": true,
            "Paused": false,
            "Restarting": false,
            "OOMKilled": false,
            "Dead": false,
            "Pid": 22917,
            "ExitCode": 0,
            "Error": "",
            "StartedAt": "2018-04-30T14:30:31.699161247Z",
            "FinishedAt": "0001-01-01T00:00:00Z"
        },
        "Image": "sha256:b17bd9d70e8b7c892f256499ef7a0a408b4a60f911640930bdac5292c0bd327e",
        "ResolvConfPath": "/var/lib/docker/containers/004de4cb27f124002c6142c1412603d319f3a1f71af7605b0c9ca168d7d4b3d3/resolv.conf",
        "HostnamePath": "/var/lib/docker/containers/004de4cb27f124002c6142c1412603d319f3a1f71af7605b0c9ca168d7d4b3d3/hostname",
        "HostsPath": "/var/lib/docker/containers/004de4cb27f124002c6142c1412603d319f3a1f71af7605b0c9ca168d7d4b3d3/hosts",
        "LogPath": "/var/lib/docker/containers/004de4cb27f124002c6142c1412603d319f3a1f71af7605b0c9ca168d7d4b3d3/004de4cb27f124002c6142c1412603d319f3a1f71af7605b0c9ca168d7d4b3d3-json.log",
        "Name": "/rabbitmq",
        "RestartCount": 0,
        "Driver": "overlay2",
        "Platform": "linux",
        "MountLabel": "",
        "ProcessLabel": "",
        "AppArmorProfile": "",
        "ExecIDs": null,
        "HostConfig": {
            "Binds": [
                "/srv/rabbitmq/data:/var/lib/rabbitmq",
                "/srv/rabbitmq/.erlang.cookie:/var/lib/rabbitmq/.erlang.cookie",
                "/srv/rabbitmq/.erlang.cookie:/root/.erlang.cookie"
            ],
            "ContainerIDFile": "",
            "LogConfig": {
                "Type": "json-file",
                "Config": {}
            },
            "NetworkMode": "host",
            "PortBindings": {},
            "RestartPolicy": {
                "Name": "no",
                "MaximumRetryCount": 0
            },
            "AutoRemove": false,
            "VolumeDriver": "",
            "VolumesFrom": null,
            "CapAdd": null,
            "CapDrop": null,
            "Dns": [],
            "DnsOptions": [],
            "DnsSearch": [],
            "ExtraHosts": null,
            "GroupAdd": null,
            "IpcMode": "shareable",
            "Cgroup": "",
            "Links": null,
            "OomScoreAdj": 0,
            "PidMode": "",
            "Privileged": false,
            "PublishAllPorts": false,
            "ReadonlyRootfs": false,
            "SecurityOpt": null,
            "UTSMode": "",
            "UsernsMode": "",
            "ShmSize": 67108864,
            "Runtime": "runc",
            "ConsoleSize": [
                0,
                0
            ],
            "Isolation": "",
            "CpuShares": 0,
            "Memory": 0,
            "NanoCpus": 0,
            "CgroupParent": "",
            "BlkioWeight": 0,
            "BlkioWeightDevice": [],
            "BlkioDeviceReadBps": null,
            "BlkioDeviceWriteBps": null,
            "BlkioDeviceReadIOps": null,
            "BlkioDeviceWriteIOps": null,
            "CpuPeriod": 0,
            "CpuQuota": 0,
            "CpuRealtimePeriod": 0,
            "CpuRealtimeRuntime": 0,
            "CpusetCpus": "",
            "CpusetMems": "",
            "Devices": [],
            "DeviceCgroupRules": null,
            "DiskQuota": 0,
            "KernelMemory": 0,
            "MemoryReservation": 0,
            "MemorySwap": 0,
            "MemorySwappiness": null,
            "OomKillDisable": false,
            "PidsLimit": 0,
            "Ulimits": null,
            "CpuCount": 0,
            "CpuPercent": 0,
            "IOMaximumIOps": 0,
            "IOMaximumBandwidth": 0
        },
        "GraphDriver": {
            "Data": {
                "LowerDir": "/var/lib/docker/overlay2/1074d7f44c75661fa47887745c3c9d67a44105878c202407881386a9f2a6336d-init/diff:/var/lib/docker/overlay2/db37ab652515d91dda05228238efbc5900edae86915b75d5e367c5b6e64171f3/diff:/var/lib/docker/overlay2/71a2dee5afce0118db56ba42aa8103e3a4223cccacb4eeecb5d7683ecafa8c62/diff:/var/lib/docker/overlay2/2deb51ec8121a270a76df3f22b28745aec3a4cf0983007f0b0bb30f125613d0a/diff:/var/lib/docker/overlay2/0f1f5e2eac08dddf4cec7e84e90e5ccb19264a3c562b225817fb4f53def21b03/diff:/var/lib/docker/overlay2/9b6e16a44353db50c8b5069cbc7909aa996e6fbc8d4e2b3228ff2f0e5bc72c58/diff:/var/lib/docker/overlay2/e4e137be855e1fded5f3b2523985b09d92173ae0f17808ef6015238b4972472e/diff:/var/lib/docker/overlay2/5d1eec78c0487a48d6a38464fbab3ebc5f0a81d076a45b6c4e630c2848f14e8f/diff:/var/lib/docker/overlay2/9c311c0e9a7ea8d82991158e7ab5af084a0bfafb6198e5206b963c72dc4a561f/diff:/var/lib/docker/overlay2/fcdda75a0cf60a049f851c1c559081ad7287cfd8a76d883b04d2c4664683de73/diff:/var/lib/docker/overlay2/fb5cb0278afaeea249322ae87b43175b5709c8a22fe17ea4efd74522d7f85c34/diff:/var/lib/docker/overlay2/3b24b0c1eb631a16b490f81da83bcad00e40d7ac4cd2ddc561cc4844f49dc73b/diff:/var/lib/docker/overlay2/13b16aae68a1184d20e5f498ef5bfe8cb28964d88da4aa7bc19061790825bee1/diff",
                "MergedDir": "/var/lib/docker/overlay2/1074d7f44c75661fa47887745c3c9d67a44105878c202407881386a9f2a6336d/merged",
                "UpperDir": "/var/lib/docker/overlay2/1074d7f44c75661fa47887745c3c9d67a44105878c202407881386a9f2a6336d/diff",
                "WorkDir": "/var/lib/docker/overlay2/1074d7f44c75661fa47887745c3c9d67a44105878c202407881386a9f2a6336d/work"
            },
            "Name": "overlay2"
        },
        "Mounts": [
            {
                "Type": "bind",
                "Source": "/srv/rabbitmq/data",
                "Destination": "/var/lib/rabbitmq",
                "Mode": "",
                "RW": true,
                "Propagation": "rprivate"
            },
            {
                "Type": "bind",
                "Source": "/srv/rabbitmq/.erlang.cookie",
                "Destination": "/var/lib/rabbitmq/.erlang.cookie",
                "Mode": "",
                "RW": true,
                "Propagation": "rprivate"
            },
            {
                "Type": "bind",
                "Source": "/srv/rabbitmq/.erlang.cookie",
                "Destination": "/root/.erlang.cookie",
                "Mode": "",
                "RW": true,
                "Propagation": "rprivate"
            }
        ],
        "Config": {
            "Hostname": "clu-1-b",
            "Domainname": "",
            "User": "",
            "AttachStdin": false,
            "AttachStdout": true,
            "AttachStderr": true,
            "ExposedPorts": {
                "25672/tcp": {},
                "4369/tcp": {},
                "5671/tcp": {},
                "5672/tcp": {}
            },
            "Tty": false,
            "OpenStdin": false,
            "StdinOnce": false,
            "Env": [
                "PATH=/usr/lib/rabbitmq/bin:/usr/local/sbin:/usr/local/bin:/usr/sbin:/usr/bin:/sbin:/bin",
                "GOSU_VERSION=1.10",
                "RABBITMQ_LOGS=-",
                "RABBITMQ_SASL_LOGS=-",
                "RABBITMQ_GPG_KEY=0A9AF2115F4687BD29803A206B73A36E6026DFCA",
                "RABBITMQ_VERSION=3.7.4",
                "RABBITMQ_GITHUB_TAG=v3.7.4",
                "RABBITMQ_DEBIAN_VERSION=3.7.4-1",
                "LANG=C.UTF-8",
                "HOME=/var/lib/rabbitmq"
            ],
            "Cmd": [
                "rabbitmq-server"
            ],
            "ArgsEscaped": true,
            "Image": "rabbitmq:3.7.4",
            "Volumes": {
                "/var/lib/rabbitmq": {}
            },
            "WorkingDir": "",
            "Entrypoint": [
                "docker-entrypoint.sh"
            ],
            "OnBuild": null,
            "Labels": {}
        },
        "NetworkSettings": {
            "Bridge": "",
            "SandboxID": "172c42ea18caf66008446f861d095060f2536ea53156bae7ceeb71a73da343f1",
            "HairpinMode": false,
            "LinkLocalIPv6Address": "",
            "LinkLocalIPv6PrefixLen": 0,
            "Ports": {},
            "SandboxKey": "/var/run/docker/netns/default",
            "SecondaryIPAddresses": null,
            "SecondaryIPv6Addresses": null,
            "EndpointID": "",
            "Gateway": "",
            "GlobalIPv6Address": "",
            "GlobalIPv6PrefixLen": 0,
            "IPAddress": "",
            "IPPrefixLen": 0,
            "IPv6Gateway": "",
            "MacAddress": "",
            "Networks": {
                "host": {
                    "IPAMConfig": null,
                    "Links": null,
                    "Aliases": null,
                    "NetworkID": "4ae2e56949b4cf94adccebe778aba224995a731e22b39667614883c10e8dcbb2",
                    "EndpointID": "9e6e4f2e15d3b73245c7fe949575cbcc818c48f04d4956d2c7669d42381c0702",
                    "Gateway": "",
                    "IPAddress": "",
                    "IPPrefixLen": 0,
                    "IPv6Gateway": "",
                    "GlobalIPv6Address": "",
                    "GlobalIPv6PrefixLen": 0,
                    "MacAddress": "",
                    "DriverOpts": null
                }
            }
        }
    }
]
```

**Comment by kjnilsson** [comment]
This appears to be a question about the rabbitmq docker image - we do not maintain this image but I believe you can raise issues here: https://github.com/docker-library/rabbitmq/issues

**Comment by jangrewe** [comment]
@kjnilsson I already did that (https://github.com/docker-library/rabbitmq/issues/253), and over there they're `inclined to think this is probably an issue with [...] the management plugin itself`.

**Comment by michaelklishin** [comment]
The error says that an HTTP server socket was in an `einval` state. Without a way to reliably reproduce  I dare to say it's very likely an environment-specific problem. Anyhow, our team does not use GitHub issues for investigations.

**Comment by matikij** [comment]
So the reason for these in our environemnt is most likely haproxy healthchecks:

```
listen rabbitmq-api
  bind 127.0.0.1:15672 
  balance  roundrobin
  mode  http
  option  httplog
  option  httpchk GET /
  stats  enable
  server clu-1-b.mfb.local-15672 clu-1-b.mfb.local:15672 check
```
Apparently management plugin (or Cowboy?) doesn't like the connection being reset by the client instead of the normal connection teardown. See the tcpdump at the end of this comment.

This seems like bug, but maybe crashing is the correct way of dealing with such situations.

```
14:42:53.881794 IP (tos 0x0, ttl 64, id 37385, offset 0, flags [DF], proto TCP (6), length 60)
    haproxy.56283 > rabbitmq.15672: Flags [S], cksum 0x3b85 (correct), seq 1648037026, win 29200, options [mss 1460,sackOK,TS val 1595580075 ecr 0,nop,wscale 7], length 0
14:42:53.881839 IP (tos 0x0, ttl 64, id 0, offset 0, flags [DF], proto TCP (6), length 60)
    rabbitmq.15672 > haproxy.56283: Flags [S.], cksum 0x14e2 (incorrect -> 0x8645), seq 3574087362, ack 1648037027, win 28960, options [mss 1460,sackOK,TS val 1378570280 ecr 1595580075,nop,wscale 7], length 0
14:42:53.881901 IP (tos 0x0, ttl 64, id 37386, offset 0, flags [DF], proto TCP (6), length 52)
    haproxy.56283 > rabbitmq.15672: Flags [.], cksum 0x254d (correct), ack 1, win 229, options [nop,nop,TS val 1595580075 ecr 1378570280], length 0
14:42:53.881925 IP (tos 0x0, ttl 64, id 37387, offset 0, flags [DF], proto TCP (6), length 70)
    haproxy.56283 > rabbitmq.15672: Flags [P.], cksum 0x4693 (correct), seq 1:19, ack 1, win 229, options [nop,nop,TS val 1595580075 ecr 1378570280], length 18
14:42:53.881937 IP (tos 0x0, ttl 64, id 28395, offset 0, flags [DF], proto TCP (6), length 52)
    rabbitmq.15672 > haproxy.56283: Flags [.], cksum 0x14da (incorrect -> 0x253d), ack 19, win 227, options [nop,nop,TS val 1378570280 ecr 1595580075], length 0
14:42:53.883187 IP (tos 0x0, ttl 64, id 28396, offset 0, flags [DF], proto TCP (6), length 256)
    rabbitmq.15672 > haproxy.56283: Flags [P.], cksum 0x15a6 (incorrect -> 0xb123), seq 1:205, ack 19, win 227, options [nop,nop,TS val 1378570281 ecr 1595580075], length 204
14:42:53.883286 IP (tos 0x0, ttl 64, id 37388, offset 0, flags [DF], proto TCP (6), length 52)
    haproxy.56283 > rabbitmq.15672: Flags [.], cksum 0x2466 (correct), ack 205, win 237, options [nop,nop,TS val 1595580075 ecr 1378570281], length 0
14:42:53.883327 IP (tos 0x0, ttl 64, id 37389, offset 0, flags [DF], proto TCP (6), length 52)
    haproxy.56283 > rabbitmq.15672: Flags [R.], cksum 0x2462 (correct), seq 19, ack 205, win 237, options [nop,nop,TS val 1595580075 ecr 1378570281], length 0
```

**Comment by michaelklishin** [comment]
@matikij that's something that should be addressed in Cowboy. I think it's a reasonable usability improvement to suggest to the Cowboy maintainer, @essen. This plugin does not control how Cowboy manages TCP sockets and their lifecycle events.

**Comment by michaelklishin** [comment]
@matikij in RabbitMQ connection management we strive to minimise log noise when a connection is closing (since we cannot do much about that anyway). It's a sensible thing to do from the support load and operability perspective.
